{"asset_id": "042983E8-9A90-4A58-887E-5F12AE1DCE7D-97294", "created_at": "2026-08-25T14:45:00", "data_origin": "observed", "evidence_ids": ["ev_0123456789abcdef0123"], "knowledge_chunk_ids": [], "model_name": "rules_data_readiness_v1", "model_version": "1.0.0", "output_type": "readiness_route", "schema_version": "1.0.0", "uncertainty": "assist_only; not a failure probability", "value": "human_review"}
